{
  "mode": "consult",
  "question": "How should I implement a new review screen for returns exceptions?",
  "domains": ["governance", "architecture"],
  "area_id": "returns-exceptions",
  "paths": [
    "fixtures/returns-pilot/frontend/app/exceptions/page.tsx"
  ],
  "task_context": {
    "feature_summary": "Add a triage screen for returns exceptions with filters, detail panel, and resolution actions.",
    "subsystem": "returns"
  }
}
